<!ELEMENT users (user+)>

<!ELEMENT user (role+)>
<!ATTLIST user
	login CDATA #REQUIRED
	password CDATA #REQUIRED
	firstName CDATA #IMPLIED
	lastName CDATA #IMPLIED
	dept CDATA #IMPLIED
	workPhone CDATA #IMPLIED
	homePhone CDATA #IMPLIED
	cellPhone CDATA #IMPLIED
	email CDATA #IMPLIED
>

<!ELEMENT role EMPTY>
<!ATTLIST role
	name CDATA #REQUIRED
>


