<?xml version="1.0" encoding="ISO-8859-1"?>
<!DOCTYPE config SYSTEM "file://users.dtd">

<users>
	<user name="superadmin" password="123">
		<role name="user"/>
		<role name="admin"/>
		<role name="super-admin"/>
	</user>
	<user name="admin" password="123">
		<role name="user"/>
		<role name="admin"/>
	</user>
	<user name="user1" password="123">
		<role name="user"/>
	</user>
	<user name="user2" password="456">
		<role name="user"/>
	</user>
	<user name="user3" password="789">
		<role name="user"/>
	</user>
</users>